{"$schema":"https://json-schema.org/draft/2020-12/schema","title":"Atlas Source","type":"object","required":["id","type","title","publisher","publication_date","status","accessed_at","url","official_reference"],"properties":{"id":{"type":"string"},"type":{"type":"string"},"title":{"type":"string"},"publisher":{"type":"string"},"publication_date":{"type":"string"},"version":{"type":"string"},"status":{"type":"string"},"accessed_at":{"type":"string","format":"date"},"url":{"type":"string","format":"uri"},"official_reference":{"type":"boolean"}},"additionalProperties":true}
